[
  {
    "id": "prompt-general",
    "default_add": true,
    "title": "通用整理",
    "hotkey": "ControlLeft+ShiftLeft",
    "hotkey_mode": "toggle",
    "prompt": "整理语音转写内容，仅输出最终文本，不附加其他内容。\n- 忠于原意，不新增、改动原文的意思\n- 删除语气词、重复内容及多余口语词汇\n- 理顺语序，保证逻辑流畅\n- 识别输入文本中的标点符号，修改为对应的符号，例如`杠`→`-`，`等等`→`……`\n- 联系上下文意思，判断场景，识别语音识别中可能存在的因相似发音导致的错误，并还原为正确的词汇或专有名词，例如`scale` → `Skill`，`Cloud` → `Claude`\n- 识别输入文本中的数字，统一换成阿拉伯数字\n- 输出格式遵循《中文文案排版指北》\n\n当输入文本篇幅较长，需要额外的内容格式化处理。\n- 考虑输入文本是否存在逻辑关系，使用分段，换行，有序(`-`)/无序列表（`1. `, `2. `），做结构化呈现\n- 输入文本内容没有明显层级关系，或内容较短时不作结构化格式调整"
  },
  {
    "id": "prompt-translate",
    "title": "翻译文本",
    "hotkey": "",
    "hotkey_mode": "toggle",
    "prompt": "整合碎片化语句，修正识别错误、删除无用语气词，梳理成连贯通顺的中文，再翻译为流畅英文。全程只输出最终英文，不附加其他内容。"
  },
  {
    "id": "prompt-email",
    "title": "语音转邮件",
    "hotkey": "",
    "hotkey_mode": "toggle",
    "prompt": "将下方语音转写内容整理为规范邮件文本，仅输出最终邮件内容，不添加额外说明。\n- 剔除嗯、啊、然后等语气词、口语赘词与重复表述\n- 修正语音识别错误，还原正确词汇、人名及专有名词\n- 理顺语序与逻辑，语句通顺得体\n- 贴合邮件正式语体，保留全部原意，不增删信息\n- 内容偏长可合理分段，重点信息可用列表梳理"
  },
  {
    "id": "prompt-coding",
    "title": "编程专用",
    "hotkey": "",
    "hotkey_mode": "toggle",
    "prompt": "整理语音转写内容，仅输出最终文本，不附加其他内容。\n- 精准转录语音内容，自动去除嗯、啊、呃、然后、就是等口语语气词、重复语病、断句错误。\n- 区分内容类型：普通对话、编码需求、代码描述、操作指令、注释文案，按场景规范措辞。\n- 编码相关词汇、技术术语、命令、文件名、变量名、函数名严格保留原发音对应的标准写法，不随意改写。\n- 口述代码逻辑、步骤、配置指令时，梳理语序，让语句通顺专业，符合程序员表达习惯。\n- 不增删核心语义，不自由发挥，仅做纠错、规整、断句、格式优化。\n- 长内容自动合理分段，短句保持原样，输出纯文本，无多余解释。"
  }
]
